{"$schema":"https://json-schema.org/draft/2020-12/schema","title":"Profile Observation — illustrative architecture contract","description":"Design artifact only. JSON validation does not establish runtime authority, factual accuracy or platform permission.","type":"object","additionalProperties":false,"properties":{"schema_version":{"const":"1.0.0"},"record_type":{"const":"ProfileObservation"},"data_classification":{"enum":["SYNTHETIC_FIXTURE","RIGHTS_CLEARED_PROFILE"]},"observation_id":{"type":"string","minLength":1},"encounter_id":{"type":"string","minLength":1},"profile_id":{"type":["string","null"]},"platform":{"enum":["jimu","hellotalk","synthetic"]},"account_id":{"type":"string","minLength":1},"device_id":{"type":"string","minLength":1},"device_boot_id":{"type":"string","minLength":1},"session_id":{"type":"string","minLength":1},"lease_epoch":{"type":"integer","minimum":0},"app_version":{"type":"string","minLength":1},"adapter_manifest_id":{"type":"string","minLength":1},"observed_at":{"type":"string","format":"date-time"},"frame_sha256":{"type":"string","pattern":"^[a-f0-9]{64}$"},"source_envelope_ids":{"type":"array","items":{"type":"string","minLength":1},"minItems":1},"fields":{"type":"array","items":{"type":"object","additionalProperties":false,"properties":{"field_id":{"type":"string","minLength":1},"name":{"type":"string","minLength":1},"state":{"enum":["PRESENT","ABSENT","NOT_OBSERVED","UNREADABLE","CONFLICT"]},"value":{"type":["string","number","boolean","array","object","null"]},"source_kind":{"enum":["UI_TREE","OCR","PLATFORM_DISPLAY","HUMAN_CORRECTION"]},"source_observation_ids":{"type":"array","items":{"type":"string","minLength":1},"minItems":1},"raw_text":{"type":["string","null"]},"extractor_version":{"type":"string","minLength":1},"extraction_confidence":{"type":["number","null"],"minimum":0,"maximum":1}},"required":["field_id","name","state","value","source_kind","source_observation_ids","raw_text","extractor_version","extraction_confidence"],"allOf":[{"if":{"properties":{"state":{"const":"PRESENT"}},"required":["state"]},"then":{"properties":{"value":{"not":{"type":"null"}}}}},{"if":{"properties":{"state":{"enum":["ABSENT","NOT_OBSERVED","UNREADABLE","CONFLICT"]}},"required":["state"]},"then":{"properties":{"value":{"type":"null"}}}}]},"minItems":0},"eligibility":{"type":"object","additionalProperties":false,"properties":{"status":{"enum":["ACCEPTED_ADULT_DISPLAY","INELIGIBLE","UNKNOWN"]},"displayed_age":{"type":["integer","null"],"minimum":0,"maximum":130},"source_field_ids":{"type":"array","items":{"type":"string","minLength":1},"minItems":0},"rule_version":{"type":"string","minLength":1}},"required":["status","displayed_age","source_field_ids","rule_version"],"allOf":[{"if":{"properties":{"status":{"const":"ACCEPTED_ADULT_DISPLAY"}},"required":["status"]},"then":{"properties":{"displayed_age":{"type":"integer","minimum":18,"maximum":130},"source_field_ids":{"type":"array","items":{"type":"string","minLength":1},"minItems":1}}}}]},"rights_scope_id":{"type":"string","minLength":1},"reachability":{"type":"object","additionalProperties":false,"properties":{"state":{"enum":["CURRENT_CARD","VERIFIED_REVISIT","NOT_REACHABLE","UNKNOWN"]},"revisit_contract_id":{"type":["string","null"]},"reachable_until":{"type":["string","null"],"format":"date-time"}},"required":["state","revisit_contract_id","reachable_until"]}},"required":["schema_version","record_type","data_classification","observation_id","encounter_id","profile_id","platform","account_id","device_id","device_boot_id","session_id","lease_epoch","app_version","adapter_manifest_id","observed_at","frame_sha256","source_envelope_ids","fields","eligibility","rights_scope_id","reachability"]}
